{
  "version": "current-source-model-target-quality-runner-mock-evidence.v1",
  "kind": "current_source_model_target_quality_runner_mock_evidence",
  "evidence_scope": "single_model_live_runner_contract_and_fail_closed_oracle",
  "runtime": "mock-only-no-queue",
  "hashes": {
    "src/existing-model-edit-proposer.mjs": "sha256:3d8c42ba3c869c2d72b4e8a456cf1159bbdb22eb79c63fba1710734f75335c1a",
    "scripts/run-current-source-model-target-quality-live.mjs": "sha256:1510a127293d76b8269fa1d749a8c41a1a22a1ea31bf11619c392179e1deb007",
    "schema/current-source-model-target-quality-live-report-v1.schema.json": "sha256:8618995e0b923c625385667c4bcfbc5a51cf25115adbd5fca2ff33b6e05a11cf",
    "schema/current-source-model-target-quality-runner-mock-evidence-v1.schema.json": "sha256:b434f3709b3fb7aef5c2b6df06dfe2425c34759907f9565f71bf0f2978d8a8fb",
    "test/current-source-model-target-quality-live.mjs": "sha256:8e5e9b346f86f6536e5a454e0007f6c3d4792672c80ad2a443f71d219e4aaadf",
    "test/current-source-model-target-quality-mock-evidence.mjs": "sha256:20022066551339a0c127a7da0f946b4acdab46d9e1258d28f6e4979131b52ec4",
    "test/model-graph-proposer.mjs": "sha256:0e09214fc12b09362cf847baaef07d80688e9875bc44aa4a93ad7f2370bd8b0a"
  },
  "contract": {
    "report_version": "current-source-model-target-quality-live-report.v1",
    "explicit_runtime_queue_required": true,
    "queue_required_flag": true,
    "prepared_copy_confirmation_required": true,
    "expected_model_sha256_required": true,
    "allowed_model_root_required": true,
    "active_model_switch_performed_by_runner": false,
    "proposal_only": true
  },
  "scenarios": {
    "unique_eligible_maximum_selected_for_review_only": true,
    "equal_volume_abstention": true,
    "locked_largest_abstention": true,
    "ineligible_largest_abstention": true,
    "incomplete_projection_abstention": true,
    "empty_projection_abstention": true,
    "wrong_target_rejected": true,
    "untrusted_text_cannot_break_geometry_tie": true,
    "trusted_object_scope_can_resolve_duplicate_bbox_layers": true
  },
  "weak_client": {
    "level": "L0",
    "vision": false,
    "local_files": false,
    "structured_output": false,
    "context": "short",
    "parallel": false,
    "max_in_flight": 1
  },
  "tests": {
    "runner_assertions": 72,
    "runner_negative_schema_cases": 7,
    "proposer_contract_passed": true,
    "default_live_queue_calls": 0,
    "mutation_requested": false
  },
  "hard_gates": {
    "wrong_object_automatic_execution": 0,
    "unauthorized_s2_s4_execution": 0,
    "duplicate_request_duplicate_modification": 0,
    "ambiguous_target_automatic_selection": 0
  },
  "acceptance": {
    "single_model_runner_mock_contract": true,
    "locked_target_fallback_failed_closed": true,
    "live_queue_called": false,
    "multi_model_live_target_quality": false,
    "live_mutation": false,
    "release_acceptance": false
  },
  "boundary": "This source-bound mock evidence validates the one-model live runner contract, its independent structural oracle, and fail-closed locked, tied, incomplete, and wrong-target behavior. It does not prove any live SKP result, multi-model target quality, mutation correctness, or release acceptance."
}
